Contest, Problema, Código, En contest (Creado | Usado | Deseado), En upsolving (Creado | Usado | Deseado)
Educational Codeforces Round 159 (Div. 2), E, Trie, , Creado
Educational Codeforces Round 159 (Div. 2), F, LCA_PathQueries, , Creado (Usando el de Pietro)
Educational Codeforces Round 160 (Div. 2), E, Min-cost max-flow, , Usado
Educational Codeforces Round 160 (Div. 2), D, Sparse table (RMQ), , Usado
Educational Codeforces Round 160 (Div. 2), D, Modular arithmetic, , Usado
Good Bye 2023, A, Factorizacion, Usado (Inesesrio),
Good Bye 2023, B, Pollard-rho, Usado (Inesesrio),
Good Bye 2023, E, DFS recursivo inline, , Creado
